{
  "name": "pdf_extract",
  "description": "Extract a bounded PDF page text layer from base64 bytes; no OCR.",
  "namespace": "hammer",
  "example": "{\"name\": \"pdf_extract\", \"arguments\": {\"base64\": \"JVBERi0xLjMKJeLjz9MKMSAwIG9iago8PAovUHJvZHVjZXIgKHB5cGRmKQo+PgplbmRvYmoKMiAwIG9iago8PAovVHlwZSAvUGFnZXMKL0NvdW50IDEKL0tpZHMgWyA0IDAgUiBdCj4+CmVuZG9iagozIDAgb2JqCjw8Ci9UeXBlIC9DYXRhbG9nCi9QYWdlcyAyIDAgUgo+PgplbmRvYmoKNCAwIG9iago8PAovVHlwZSAvUGFnZQovUmVzb3VyY2VzIDw8Ci9Gb250IDw8Ci9GMSA1IDAgUgo+Pgo+PgovTWVkaWFCb3ggWyAwLjAgMC4wIDEwMCAxMDAgXQovUGFyZW50IDIgMCBSCi9Db250ZW50cyA2IDAgUgo+PgplbmRvYmoKNSAwIG9iago8PAovVHlwZSAvRm9udAovU3VidHlwZSAvVHlwZTEKL0Jhc2VGb250IC9IZWx2ZXRpY2EKPj4KZW5kb2JqCjYgMCBvYmoKPDwKL0xlbmd0aCAzNQo+PgpzdHJlYW0KQlQgL0YxIDEyIFRmIDEwIDUwIFRkIChIZWxsbykgVGogRVQKZW5kc3RyZWFtCmVuZG9iagp4cmVmCjAgNwowMDAwMDAwMDAwIDY1NTM1IGYgCjAwMDAwMDAwMTUgMDAwMDAgbiAKMDAwMDAwMDA1NCAwMDAwMCBuIAowMDAwMDAwMTEzIDAwMDAwIG4gCjAwMDAwMDAxNjIgMDAwMDAgbiAKMDAwMDAwMDI5NCAwMDAwMCBuIAowMDAwMDAwMzY0IDAwMDAwIG4gCnRyYWlsZXIKPDwKL1NpemUgNwovUm9vdCAzIDAgUgovSW5mbyAxIDAgUgo+PgpzdGFydHhyZWYKNDQ5CiUlRU9GCg==\"}}",
  "parameters": {
    "type": "object",
    "properties": {
      "base64": {
        "type": "string",
        "description": "Base64 PDF bytes.",
        "maxLength": 32000
      },
      "page": {
        "type": "integer",
        "description": "One-based page number.",
        "default": 1,
        "minimum": 1,
        "maximum": 10000
      },
      "limit": {
        "type": "integer",
        "description": "Maximum returned text characters.",
        "default": 8000,
        "minimum": 1,
        "maximum": 12000
      }
    },
    "required": [
      "base64"
    ],
    "additionalProperties": false
  },
  "policy": {
    "tiers": [
      "code_execution"
    ],
    "approval": "ask"
  },
  "capabilities": {
    "reads_workspace": false,
    "writes_workspace": false,
    "network": false,
    "executes_code": true
  },
  "daemon": false,
  "limits": {
    "timeout_seconds": 3,
    "memory_mb": 128,
    "output_kb": 32
  }
}
